{"catalog":"sha256:565979661e64e7d42f6bcfb67a56e6d4501209000f811cd4b185e49f02941632","format":"assistant-language-pack-v1","locales":{"ar":{"d88753fcdf790c53b9d6e3b0aad61656632305916539199f2c85e74c87aca10f":"اعرض مناطق Cloudflare وافحص سجلات DNS الخاصة بها عبر OAuth."},"de":{"d88753fcdf790c53b9d6e3b0aad61656632305916539199f2c85e74c87aca10f":"Cloudflare-Zonen auflisten und ihre DNS-Einträge über OAuth prüfen."},"es":{"d88753fcdf790c53b9d6e3b0aad61656632305916539199f2c85e74c87aca10f":"Lista las zonas de Cloudflare e inspecciona sus registros DNS mediante OAuth."},"fr":{"d88753fcdf790c53b9d6e3b0aad61656632305916539199f2c85e74c87aca10f":"Lister les zones Cloudflare et inspecter leurs enregistrements DNS via OAuth."},"ja":{"d88753fcdf790c53b9d6e3b0aad61656632305916539199f2c85e74c87aca10f":"OAuth で Cloudflare のゾーンを一覧表示し、DNS レコードを確認します。"},"pt":{"d88753fcdf790c53b9d6e3b0aad61656632305916539199f2c85e74c87aca10f":"Liste as zonas do Cloudflare e inspecione seus registros DNS por OAuth."},"zh":{"d88753fcdf790c53b9d6e3b0aad61656632305916539199f2c85e74c87aca10f":"通过 OAuth 列出 Cloudflare 区域并检查其 DNS 记录。"}},"policy":"sha256:7777777777777777777777777777777777777777777777777777777777777777"}