{"catalog":"sha256:038138caa07d59c19a9f4c899297b02ba3b45f10ecd6cdbb2de5397c7a9455cd","format":"assistant-language-pack-v1","locales":{"ar":{"05b8cbc401a1d398eb9311018f4b672a74689ef6ea8d062e8917382ba1372076":"AR Delete the record {record} from {zone}","2282f8a32d6993f1ba0c99fbfc2bfe73c05755628d4bc942393ce67c6357e9fd":"AR Type the value","264c70b349a2f3ab4e6111ddfda700fb47ed6ef4961ef98a96e9ff2adc38edb9":"AR Review exactly what this Action does before it continues.","2a47b5c74727c380c3766f70d270a438a5f6bc06f1e8bc9aabc7f399a21f1522":"AR First option","4ec8a1b66ecda08c4ec7f162f8e158887b4c696f0f6640cdec289c120720badc":"AR Exercise immutable admission.","5dce4e13d7e6bc9f457a5105a302a8d8791bd0101defe910d1802f1339a44eb5":"AR Choose this option to continue.","821521576d8ba96ba53e06316a358c5000393f807dd8c34acd096d9b5bd18469":"AR Exercise one reviewed Assistant through the Team test suite.","91482992871bb8a68ee31208d3775598437226adc948ccd1502d38a18eb54abb":"AR Run one reviewed test Action.","9f95ad2f15d20d78afebcdc0ea3743195a44e0e958186fea2b4c8fca6af33521":"AR Approve this Action","a166fd3dc8bf713c7b9957f6cb0e86f8c6dc7d580726ef0f874e449bd39a91dd":"AR Create a test key in the provider dashboard and copy it.","d0e869b777a6967931bd4373c58e06cb6298087670665671b42a402df024ce20":"AR Your answer"},"de":{"05b8cbc401a1d398eb9311018f4b672a74689ef6ea8d062e8917382ba1372076":"DE Delete the record {record} from {zone}","2282f8a32d6993f1ba0c99fbfc2bfe73c05755628d4bc942393ce67c6357e9fd":"DE Type the value","264c70b349a2f3ab4e6111ddfda700fb47ed6ef4961ef98a96e9ff2adc38edb9":"DE Review exactly what this Action does before it continues.","2a47b5c74727c380c3766f70d270a438a5f6bc06f1e8bc9aabc7f399a21f1522":"DE First option","4ec8a1b66ecda08c4ec7f162f8e158887b4c696f0f6640cdec289c120720badc":"DE Exercise immutable admission.","5dce4e13d7e6bc9f457a5105a302a8d8791bd0101defe910d1802f1339a44eb5":"DE Choose this option to continue.","821521576d8ba96ba53e06316a358c5000393f807dd8c34acd096d9b5bd18469":"DE Exercise one reviewed Assistant through the Team test suite.","91482992871bb8a68ee31208d3775598437226adc948ccd1502d38a18eb54abb":"DE Run one reviewed test Action.","9f95ad2f15d20d78afebcdc0ea3743195a44e0e958186fea2b4c8fca6af33521":"DE Approve this Action","a166fd3dc8bf713c7b9957f6cb0e86f8c6dc7d580726ef0f874e449bd39a91dd":"DE Create a test key in the provider dashboard and copy it.","d0e869b777a6967931bd4373c58e06cb6298087670665671b42a402df024ce20":"DE Your answer"},"es":{"05b8cbc401a1d398eb9311018f4b672a74689ef6ea8d062e8917382ba1372076":"ES Delete the record {record} from {zone}","2282f8a32d6993f1ba0c99fbfc2bfe73c05755628d4bc942393ce67c6357e9fd":"ES Type the value","264c70b349a2f3ab4e6111ddfda700fb47ed6ef4961ef98a96e9ff2adc38edb9":"ES Review exactly what this Action does before it continues.","2a47b5c74727c380c3766f70d270a438a5f6bc06f1e8bc9aabc7f399a21f1522":"ES First option","4ec8a1b66ecda08c4ec7f162f8e158887b4c696f0f6640cdec289c120720badc":"ES Exercise immutable admission.","5dce4e13d7e6bc9f457a5105a302a8d8791bd0101defe910d1802f1339a44eb5":"ES Choose this option to continue.","821521576d8ba96ba53e06316a358c5000393f807dd8c34acd096d9b5bd18469":"ES Exercise one reviewed Assistant through the Team test suite.","91482992871bb8a68ee31208d3775598437226adc948ccd1502d38a18eb54abb":"ES Run one reviewed test Action.","9f95ad2f15d20d78afebcdc0ea3743195a44e0e958186fea2b4c8fca6af33521":"ES Approve this Action","a166fd3dc8bf713c7b9957f6cb0e86f8c6dc7d580726ef0f874e449bd39a91dd":"ES Create a test key in the provider dashboard and copy it.","d0e869b777a6967931bd4373c58e06cb6298087670665671b42a402df024ce20":"ES Your answer"},"fr":{"05b8cbc401a1d398eb9311018f4b672a74689ef6ea8d062e8917382ba1372076":"FR Delete the record {record} from {zone}","2282f8a32d6993f1ba0c99fbfc2bfe73c05755628d4bc942393ce67c6357e9fd":"FR Type the value","264c70b349a2f3ab4e6111ddfda700fb47ed6ef4961ef98a96e9ff2adc38edb9":"FR Review exactly what this Action does before it continues.","2a47b5c74727c380c3766f70d270a438a5f6bc06f1e8bc9aabc7f399a21f1522":"FR First option","4ec8a1b66ecda08c4ec7f162f8e158887b4c696f0f6640cdec289c120720badc":"FR Exercise immutable admission.","5dce4e13d7e6bc9f457a5105a302a8d8791bd0101defe910d1802f1339a44eb5":"FR Choose this option to continue.","821521576d8ba96ba53e06316a358c5000393f807dd8c34acd096d9b5bd18469":"FR Exercise one reviewed Assistant through the Team test suite.","91482992871bb8a68ee31208d3775598437226adc948ccd1502d38a18eb54abb":"FR Run one reviewed test Action.","9f95ad2f15d20d78afebcdc0ea3743195a44e0e958186fea2b4c8fca6af33521":"FR Approve this Action","a166fd3dc8bf713c7b9957f6cb0e86f8c6dc7d580726ef0f874e449bd39a91dd":"FR Create a test key in the provider dashboard and copy it.","d0e869b777a6967931bd4373c58e06cb6298087670665671b42a402df024ce20":"FR Your answer"},"ja":{"05b8cbc401a1d398eb9311018f4b672a74689ef6ea8d062e8917382ba1372076":"JA Delete the record {record} from {zone}","2282f8a32d6993f1ba0c99fbfc2bfe73c05755628d4bc942393ce67c6357e9fd":"JA Type the value","264c70b349a2f3ab4e6111ddfda700fb47ed6ef4961ef98a96e9ff2adc38edb9":"JA Review exactly what this Action does before it continues.","2a47b5c74727c380c3766f70d270a438a5f6bc06f1e8bc9aabc7f399a21f1522":"JA First option","4ec8a1b66ecda08c4ec7f162f8e158887b4c696f0f6640cdec289c120720badc":"JA Exercise immutable admission.","5dce4e13d7e6bc9f457a5105a302a8d8791bd0101defe910d1802f1339a44eb5":"JA Choose this option to continue.","821521576d8ba96ba53e06316a358c5000393f807dd8c34acd096d9b5bd18469":"JA Exercise one reviewed Assistant through the Team test suite.","91482992871bb8a68ee31208d3775598437226adc948ccd1502d38a18eb54abb":"JA Run one reviewed test Action.","9f95ad2f15d20d78afebcdc0ea3743195a44e0e958186fea2b4c8fca6af33521":"JA Approve this Action","a166fd3dc8bf713c7b9957f6cb0e86f8c6dc7d580726ef0f874e449bd39a91dd":"JA Create a test key in the provider dashboard and copy it.","d0e869b777a6967931bd4373c58e06cb6298087670665671b42a402df024ce20":"JA Your answer"},"pt":{"05b8cbc401a1d398eb9311018f4b672a74689ef6ea8d062e8917382ba1372076":"PT Delete the record {record} from {zone}","2282f8a32d6993f1ba0c99fbfc2bfe73c05755628d4bc942393ce67c6357e9fd":"PT Type the value","264c70b349a2f3ab4e6111ddfda700fb47ed6ef4961ef98a96e9ff2adc38edb9":"PT Review exactly what this Action does before it continues.","2a47b5c74727c380c3766f70d270a438a5f6bc06f1e8bc9aabc7f399a21f1522":"PT First option","4ec8a1b66ecda08c4ec7f162f8e158887b4c696f0f6640cdec289c120720badc":"PT Exercise immutable admission.","5dce4e13d7e6bc9f457a5105a302a8d8791bd0101defe910d1802f1339a44eb5":"PT Choose this option to continue.","821521576d8ba96ba53e06316a358c5000393f807dd8c34acd096d9b5bd18469":"PT Exercise one reviewed Assistant through the Team test suite.","91482992871bb8a68ee31208d3775598437226adc948ccd1502d38a18eb54abb":"PT Run one reviewed test Action.","9f95ad2f15d20d78afebcdc0ea3743195a44e0e958186fea2b4c8fca6af33521":"PT Approve this Action","a166fd3dc8bf713c7b9957f6cb0e86f8c6dc7d580726ef0f874e449bd39a91dd":"PT Create a test key in the provider dashboard and copy it.","d0e869b777a6967931bd4373c58e06cb6298087670665671b42a402df024ce20":"PT Your answer"},"zh":{"05b8cbc401a1d398eb9311018f4b672a74689ef6ea8d062e8917382ba1372076":"ZH Delete the record {record} from {zone}","2282f8a32d6993f1ba0c99fbfc2bfe73c05755628d4bc942393ce67c6357e9fd":"ZH Type the value","264c70b349a2f3ab4e6111ddfda700fb47ed6ef4961ef98a96e9ff2adc38edb9":"ZH Review exactly what this Action does before it continues.","2a47b5c74727c380c3766f70d270a438a5f6bc06f1e8bc9aabc7f399a21f1522":"ZH First option","4ec8a1b66ecda08c4ec7f162f8e158887b4c696f0f6640cdec289c120720badc":"ZH Exercise immutable admission.","5dce4e13d7e6bc9f457a5105a302a8d8791bd0101defe910d1802f1339a44eb5":"ZH Choose this option to continue.","821521576d8ba96ba53e06316a358c5000393f807dd8c34acd096d9b5bd18469":"ZH Exercise one reviewed Assistant through the Team test suite.","91482992871bb8a68ee31208d3775598437226adc948ccd1502d38a18eb54abb":"ZH Run one reviewed test Action.","9f95ad2f15d20d78afebcdc0ea3743195a44e0e958186fea2b4c8fca6af33521":"ZH Approve this Action","a166fd3dc8bf713c7b9957f6cb0e86f8c6dc7d580726ef0f874e449bd39a91dd":"ZH Create a test key in the provider dashboard and copy it.","d0e869b777a6967931bd4373c58e06cb6298087670665671b42a402df024ce20":"ZH Your answer"}},"policy":"sha256:7777777777777777777777777777777777777777777777777777777777777777"}