{"catalog":"sha256:364a5ac47887c202106585eb62c7396003847ceb230b82f89fbc5701ce339f7c","format":"assistant-language-pack-v1","locales":{"ar":{"982e873f2f6117c5e4ee39f5ca16eb45e62bd1bb7ce32e9642f563769475a4d6":"اعرض سجلات DNS لمنطقة واحدة.","b200f63f5784ccaab564f1b6f58ae48f5b90bd6fcb0d6d8903e54037f46efb22":"تصفح مناطق حساب Cloudflare الخاص بك واقرأ سجلات DNS لكل منطقة. كل إجراء يقرأ فقط؛ لا يتغير شيء في حسابك.","c7f2da0ee259e3e8c7fe949cbc8ba9daf5fc50cf8273626b128e8b906067bdc4":"اعرض مناطق Cloudflare الخاصة بك.","d88753fcdf790c53b9d6e3b0aad61656632305916539199f2c85e74c87aca10f":"اعرض مناطق Cloudflare وافحص سجلات DNS الخاصة بها عبر OAuth."},"de":{"982e873f2f6117c5e4ee39f5ca16eb45e62bd1bb7ce32e9642f563769475a4d6":"Die DNS-Einträge einer Zone auflisten.","b200f63f5784ccaab564f1b6f58ae48f5b90bd6fcb0d6d8903e54037f46efb22":"Durchsuchen Sie die Zonen Ihres Cloudflare-Kontos und lesen Sie die DNS-Einträge jeder Zone. Jede Aktion liest nur; in Ihrem Konto ändert sich nichts.","c7f2da0ee259e3e8c7fe949cbc8ba9daf5fc50cf8273626b128e8b906067bdc4":"Ihre Cloudflare-Zonen auflisten.","d88753fcdf790c53b9d6e3b0aad61656632305916539199f2c85e74c87aca10f":"Cloudflare-Zonen auflisten und ihre DNS-Einträge über OAuth prüfen."},"es":{"982e873f2f6117c5e4ee39f5ca16eb45e62bd1bb7ce32e9642f563769475a4d6":"Lista los registros DNS de una zona.","b200f63f5784ccaab564f1b6f58ae48f5b90bd6fcb0d6d8903e54037f46efb22":"Explora las zonas de tu cuenta de Cloudflare y lee los registros DNS de cada zona. Cada acción solo lee; nada cambia en tu cuenta.","c7f2da0ee259e3e8c7fe949cbc8ba9daf5fc50cf8273626b128e8b906067bdc4":"Lista tus zonas de Cloudflare.","d88753fcdf790c53b9d6e3b0aad61656632305916539199f2c85e74c87aca10f":"Lista las zonas de Cloudflare e inspecciona sus registros DNS mediante OAuth."},"fr":{"982e873f2f6117c5e4ee39f5ca16eb45e62bd1bb7ce32e9642f563769475a4d6":"Lister les enregistrements DNS d'une zone.","b200f63f5784ccaab564f1b6f58ae48f5b90bd6fcb0d6d8903e54037f46efb22":"Parcourez les zones de votre compte Cloudflare et lisez les enregistrements DNS de chaque zone. Chaque action se contente de lire ; rien ne change dans votre compte.","c7f2da0ee259e3e8c7fe949cbc8ba9daf5fc50cf8273626b128e8b906067bdc4":"Lister vos zones Cloudflare.","d88753fcdf790c53b9d6e3b0aad61656632305916539199f2c85e74c87aca10f":"Lister les zones Cloudflare et inspecter leurs enregistrements DNS via OAuth."},"ja":{"982e873f2f6117c5e4ee39f5ca16eb45e62bd1bb7ce32e9642f563769475a4d6":"1 つのゾーンの DNS レコードを一覧表示します。","b200f63f5784ccaab564f1b6f58ae48f5b90bd6fcb0d6d8903e54037f46efb22":"Cloudflare アカウントのゾーンを参照し、各ゾーンの DNS レコードを読み取ります。どのアクションも読み取りのみで、アカウントは変更されません。","c7f2da0ee259e3e8c7fe949cbc8ba9daf5fc50cf8273626b128e8b906067bdc4":"Cloudflare のゾーンを一覧表示します。","d88753fcdf790c53b9d6e3b0aad61656632305916539199f2c85e74c87aca10f":"OAuth で Cloudflare のゾーンを一覧表示し、DNS レコードを確認します。"},"pt":{"982e873f2f6117c5e4ee39f5ca16eb45e62bd1bb7ce32e9642f563769475a4d6":"Liste os registros DNS de uma zona.","b200f63f5784ccaab564f1b6f58ae48f5b90bd6fcb0d6d8903e54037f46efb22":"Navegue pelas zonas da sua conta Cloudflare e leia os registros DNS de cada zona. Cada ação apenas lê; nada muda na sua conta.","c7f2da0ee259e3e8c7fe949cbc8ba9daf5fc50cf8273626b128e8b906067bdc4":"Liste suas zonas do Cloudflare.","d88753fcdf790c53b9d6e3b0aad61656632305916539199f2c85e74c87aca10f":"Liste as zonas do Cloudflare e inspecione seus registros DNS por OAuth."},"zh":{"982e873f2f6117c5e4ee39f5ca16eb45e62bd1bb7ce32e9642f563769475a4d6":"列出一个区域的 DNS 记录。","b200f63f5784ccaab564f1b6f58ae48f5b90bd6fcb0d6d8903e54037f46efb22":"浏览您的 Cloudflare 账户中的区域，并读取每个区域的 DNS 记录。每个操作都只读取，您的账户不会有任何更改。","c7f2da0ee259e3e8c7fe949cbc8ba9daf5fc50cf8273626b128e8b906067bdc4":"列出您的 Cloudflare 区域。","d88753fcdf790c53b9d6e3b0aad61656632305916539199f2c85e74c87aca10f":"通过 OAuth 列出 Cloudflare 区域并检查其 DNS 记录。"}},"policy":"sha256:7777777777777777777777777777777777777777777777777777777777777777"}